company,source_type,text,published_at,source
Qantas,news,"Australia's Qantas warns of big bill from higher jet fuel prices. The cost of jet fuel in the second half of 2026 is now expected to be A$3.1 billion to A$3.3 billion, up from A$2.5 billion in Qantas' previous forecast.",2026-04-14T03:40:36Z,CNA
Qantas,news,"Lufthansa trims 20,000 flights from 2026 schedules, will ground Airbus A340-600s from high fuel costs. Lufthansa is grounding its Mitsubishi CRJs and Airbus A340-600s in response to high fuel prices.",2026-04-22T21:00:39Z,The Points Guy
Qantas,news,"Audio-Technica AT-SB727 Sound Burger Black or Yellow $159 (RRP $429) + Free Delivery @ Qantas Marketplace. Missed out on the JB Hi-Fi deal? Qantas Marketplace has got you covered! $10 more than JB Hi-Fi, and only Black and Yellow are available at this price, but you do get free delivery and 3 QFF points …",2026-04-18T22:51:25Z,Ozbargain.com.au
Qantas,news,"Bar Cart Qantas Full Cart 10 Drawers Empty [50,000 QFF Pts] - Including Delivery to Selected Postcodes. Qantas Full Cart 10 Drawers Empty - Including Delivery to Selected Postcodes Secure a piece of aviation history with a pre-loved bar cart that has proudly flown across Australia and is now ready to …",2026-04-19T03:35:44Z,Ozbargain.com.au
Qantas,news,"The history of classic airline meals in 7 courses. Through airline meals at a seven-course dinner at PDX, 150 foodies and AvGeeks recently got a crash course in the history of aviation.",2026-04-25T16:00:47Z,The Points Guy
Qantas,news,Could Australia make enough biofuel to keep us flying?. Australia exports billions of dollars worth of canola seed and corn husks to make sustainable jet fuel that is sold back to us. This is what it will take to make it here.,2026-04-19T04:12:57Z,ABC News (AU)
Santos,news,"How a remote farming community became Australia's first oil field. With oil exploration back in the headlines, here's how Australia struck it lucky in the 1960s.",2026-04-26T22:01:39Z,ABC News (AU)
Santos,news,"Santos reports $1.27bn revenue and 3% rise in production in Q1 2026. The Australian oil and gas company’s production reached 22.5mboe, up 3% year on year and 1% from the previous quarter.",2026-04-24T09:11:31Z,Offshore Technology
Santos,news,"Why Australia's big gas producers haven't jacked up domestic prices despite war. After a decade and a half of mostly failed threats from three prime ministers and constant surveillance by the competition regulator, the east coast gas export giants are suddenly putting Australians first.",2026-04-20T18:45:53Z,ABC News (AU)
Santos,news,"Australia Launches Gas Tax Review as War Fuels LNG Windfall. Australia, among the world’s top liquefied natural gas exporters, will hold an inquiry to examine taxes on oil and gas firms like Chevron Corp., Woodside Energy Group Ltd. and Santos Ltd., as the Iran war pushes up energy prices, creating a windfall for produ…",2026-03-31T05:17:12Z,Financial Post
Santos,news,"Australian Gas Exporter Santos Streamlines Business to Cut Costs. Santos Ltd. is restructuring the company’s oil and gas business in order to cut costs, according to an internal notice seen by Bloomberg, after a string of stymied takeover bids in recent years that have raised pressure to increase shareholder returns.",2026-04-22T09:48:53Z,Financial Post
Santos,news,"3 reasons why Santos shares are a screaming buy right now. The ASX energy stock has enjoyed tailwinds from reduced global oil supply.
The post 3 reasons why Santos shares are a screaming buy right now appeared first on The Motley Fool Australia.",2026-04-16T02:18:49Z,Motley Fool Australia
Santos,news,"4 ASX 200 energy shares rated buys. ASX 200 energy shares have skyrocketed 14% over the past month. 
The post 4 ASX 200 energy shares rated buys appeared first on The Motley Fool Australia.",2026-03-31T02:14:44Z,Motley Fool Australia
Santos,news,"ASX shares to watch as oil price crashes. The turnaround in oil prices is a huge headwind for the ASX shares.
The post ASX shares to watch as oil price crashes appeared first on The Motley Fool Australia.",2026-04-08T02:11:51Z,Motley Fool Australia
Santos,news,"ASX 200 energy shares lift as pessimism over Iran war deepens. Oil and gas prices have spiked 15% to 18% this week amid ongoing constrained global supply.
The post ASX 200 energy shares lift as pessimism over Iran war deepens appeared first on The Motley Fool Australia.",2026-04-24T03:02:08Z,Motley Fool Australia
Santos,news,"Is there really untold oil wealth in Queensland’s Taroom Trough? Here’s why scepticism is warranted. During the 1973 oil shock, Queensland promised to open a huge oilfield. History is repeating as Australia searches for secure supplies of fuel.",2026-04-20T05:42:44Z,The Conversation Africa
Santos,news,"ASX 200 energy shares whipsaw amid fragile ceasefire. ASX 200 energy shares are leading the market today after a substantial sell-off yesterday. 
The post ASX 200 energy shares whipsaw amid fragile ceasefire appeared first on The Motley Fool Australia.",2026-04-09T05:49:47Z,Motley Fool Australia
Santos,news,"Gas tax fight escalates ahead of budget as inquiry begins. Calls are growing for a new 25 per cent tax on gas exports to increase the petroleum resource rent tax on windfall profits, but companies have warned any changes would jeopardise Australia's energy supply.",2026-04-20T18:42:12Z,ABC News (AU)
Santos,news,"5 things to watch on the ASX 200 on Wednesday. It looks set to be a very good day for Aussie investors today.
The post 5 things to watch on the ASX 200 on Wednesday appeared first on The Motley Fool Australia.",2026-03-31T20:00:51Z,Motley Fool Australia
Santos,news,"Asia LNG Prices Set to Fall Sharply After Deal to Reopen Hormuz. Spot liquefied natural gas prices in Asia are poised to fall roughly 17% to about $15 per million British thermal units, after the US and Iran agreed to a two-week ceasefire that could temporarily reopen the Strait of Hormuz, traders said.",2026-04-08T07:28:31Z,Financial Post
Santos,news,"Woodside, Greenpeace Reach Settlement in Greenwashing Case. The Federal Court of Australia ended proceedings in a case filed by Greenpeace Australia Pacific accusing Woodside of inaccurate climate reporting, after a settlement agreement.",2026-04-22T13:32:33Z,Rigzone
Santos,news,"Full transcript of ""Face the Nation with Margaret Brennan,"" March 29, 2026. On this ""Face the Nation with Margaret Brennan"" broadcast, Border Czar Tom Homan and former U.S. Surgeon General Jerome Adams join Margaret Brennan.",2026-03-29T18:15:29Z,CBS News
Santos,news,"Northrim BanCorp Earns $13.7 Million, or $0.61 Per Diluted Share, in First Quarter 2026. ANCHORAGE, Alaska, April 22, 2026 (GLOBE NEWSWIRE) -- Northrim BanCorp, Inc. (NASDAQ:NRIM) (“Northrim” or the “Company”) today reported net income of $13.7 million, or $0.61 per diluted share, in the first quarter of 2026, compared to $12.4 million, or $0.55 …",2026-04-22T20:15:00Z,GlobeNewswire
Santos,news,"Beetaloo locks in $66.3M to fast-track to first NT gas. Beetaloo Energy has banked $66.3M and locked in a fully funded runway to first pilot gas this year, fast-tracking its Carpentaria project and broader Beetaloo Basin growth push.",2026-04-13T05:43:00Z,The Sydney Morning Herald
NBN,news,"Supramolecular engineering of amyloid-inspired tripeptide assemblies enabling tunable piezoelectricity. Peptide assemblies can be used to prepare piezoelectric materials, but the role of peptide sequence and side chains is not well understood. Here, the authors report the study of the factors on the supramolecular stacking and piezoelectric properties of diphen…",2026-04-15T00:00:00Z,Nature.com
NBN,news,Superloop puts functional separation bid to ACCC. Regulator's initial view positive.,2026-04-15T21:58:00Z,iTnews
NBN,news,"Internal field tailoring enables low noise high speed colloidal quantum dot photodetectors beyond 1500 nm. Park et al. report a field-tailoring strategy by using n-type InAs as the absorber and p-type InAs as the hole transport layer to suppress leakage current for colloidal quantum dot photodetectors, enabling a low dark current of 9.7E-7 A cm2 and fast response …",2026-04-02T00:00:00Z,Nature.com
NBN,news,"Amazon Leo targets mid-2026 commercial launch as enterprise beta goes live. In short: Amazon’s satellite internet service, rebranded from Project Kuiper to Amazon Leo in November 2025, entered enterprise beta on April 8, 2026, with commercial availability targeted for mid-2026 per Andy Jassy’s annual shareholder letter. The service o…",2026-04-10T12:54:46Z,The Next Web
NBN,news,NBN Co overestimates costs of providing better service. By up to 92 percent.,2026-04-15T11:38:00Z,iTnews
NBN,news,NBN Co challenged on size of ARPU increases from fibre customers. As ACCC makes draft ruling on costs.,2026-03-31T19:53:18Z,iTnews
NBN,news,NBN Co pays up as FTTP service levels wobble. As copper replacement program encounters complexity.,2026-04-06T18:20:00Z,iTnews
NBN,news,"Sydney Corporate Relocations Surge in 2026 as Companies Consolidate Offices and Regional Exodus Accelerates. SYDNEY — Dozens of major companies consolidated or shifted operations within or away from Sydney in early 2026, with internal office moves and a broader urban-to-regional population shift reshaping the city's business landscape even as new tech and infrastruc…",2026-04-09T18:18:42Z,Ibtimes.com.au
Muji,news,"Your Vinyl, CDs, and Tapes Belong on a Wall, Not a Shelf. There’s a very specific kind of person who still owns vinyl, CDs, and cassettes. Not out of nostalgia for the sake of it, but because each format sounds and feels different in ways that streaming never quite figured out. The problem has always been finding a …",2026-03-29T09:00:50Z,The Gadgeteer
Muji,news,"Has the Death of the Department Store Reached Japan?. Has the demise of the department store finally arrived in Japan, which has held on to them longer than most?",2026-04-12T21:00:35Z,Livemint
LVMH,news,"Italy investigates Sephora and Benefit over marketing skincare to children. The Italian Competition Authority said luxury goods giant LVMH appears to have adopted ""particularly insidious"" marketing strategies.",2026-03-29T19:37:03Z,BBC News
LVMH,news,Exciting Google and Gucci luxury smartglasses may be a bigger deal than you think. A new wave of luxury wearable tech,2026-04-20T09:52:37Z,Android Police
LVMH,news,"5 of tech's biggest names have together seen nearly $200 billion wiped off their fortunes this year as AI fever cools. Oracle's Larry Ellison, Amazon's Jeff Bezos, and Meta's Mark Zuckerberg have seen their fortunes shrink as stocks have faltered.",2026-03-30T11:35:21Z,Business Insider
LVMH,news,"Arnault warns Middle East could spiral into 'global catastrophe'.... Despite near-term volatility, the luxury magnate remains confident about the midterm outlook and expects to remain in his job for another ""seven or eight...",2026-04-24T01:28:36Z,WWD
LVMH,news,Here's what CEOs and top execs are saying about how the Iran war is affecting business. Executives such as Goldman Sachs CEO David Solomon and LVMH CFO Cécile Cabanis have made comments on how the Iran war is affecting their businesses.,2026-04-15T12:16:06Z,Business Insider
LVMH,news,CELINE Is Too Good To Take off at the Beach (EXCLUSIVE). CELINE is one of the best things going in luxury & Summer 2026 is merely proof that creative director Michael Rider's output is as hot as the summer sun.,2026-04-17T19:37:48Z,Highsnobiety
LVMH,news,"Billionaire LVMH CEO Bernard Arnault Warns Of ‘World Catastrophe’ If Iran War Is Unresolved. Luxury brands cited a slowdown in demand throughout the conflict, disrupting earnings.",2026-04-23T13:47:00Z,Forbes
LVMH,news,LVMH’s Bumpy Quarter: What War Impact Signals About Luxury Travel. The travel industry can glean signals from LVMH's quarterly results on how the Middle East conflict is reshaping demand for high-end travel and hospitality.,2026-04-13T21:07:42Z,Skift
LVMH,news,Iran tensions drag down UAE luxury retail sales – report. Boutiques at the Mall of the Emirates recorded year-on-year sales declines of between 30% and 50% in March while overall footfall at the venue fell by 15%,2026-04-14T10:59:25Z,Retail-insight-network.com
LVMH,news,"The Most Underrated Thing at Milan Design Week? The Staff Uniforms. Milan Design Week is very different from Milan Fashion Week, but it's not an entirely fashion-less affair. Just look at the Yohji Yamamoto staff uniforms!",2026-04-22T17:01:00Z,Highsnobiety
LVMH,news,"L’Oreal Heiress Fortune Rises By $6 Billion As Company’s Shares Soar After Strong Earnings. Francoise Bettencourt Meyers, the second-richest woman in the world, entered the top 20 on Forbes’ real-time billionaires list on Thursday after her company’s shares rose sharply.",2026-04-23T10:09:36Z,Forbes
LVMH,news,"Top 10 richest people in the world: Elon Musk loses $22 billion, Jeff Bezos overtakes Sergey Brin. Top 10 richest people in the world list, April 2026: All 10 are men, each with a net worth of at least $142 billion as of April 1, down from $148 billion last month.",2026-04-03T12:36:20Z,The Indian Express
LVMH,news,"LVMH sales feel impact from war. Sales at the world's leading luxury group, LVMH, fell six percent in the first quarter of the year as the war in the Middle East depressed business in the region. The company, best known for Louis Vuitton handbags, Dior fashion, Moet &amp; Chandon champagne a…",2026-04-13T21:53:39Z,Japan Today
LVMH,news,LVMH sales hit as Middle East conflict delays luxury recovery. US and Israel’s war on Iran dented sales growth at world’s biggest luxury group.,2026-04-13T22:02:47Z,CNA
LVMH,news,Marc Jacobs’ Rachel Sennott Collab Kicks Off Pivot to Social Entertainment. Marc Jacobs teamed up with Rachel Sennott on a new microdrama as it shifts toward social-first entertainment.,2026-04-23T06:00:00Z,Adweek
LVMH,news,"Billionaire much admired by Trump warns Iran war may set off 'world catastrophe'. A French billionaire much admired by President Donald Trump warned of the Iran war's catastrophic risks to the global economy.LVMH CEO Bernard Arnault warned Thursday that failure to resolve the Middle East conflict could trigger a ""world catastrophe"" with se…",2026-04-23T17:11:52Z,Raw Story
LVMH,news,"Regulators in Italy probe Sephora, LVMH for youth marketing. The French luxury conglomerate and the LVMH-owned beauty retailer are under scrutiny for marketing to minors.",2026-03-30T18:15:37Z,Luxurydaily.com
LVMH,news,Is The RealReal (REAL) a Worthy Investment?. Michigan-based investment advisor Cedar Grove Capital Management recently released its first quarter 2026 investor letter. A copy of the letter can be...,2026-04-17T15:04:42Z,Yahoo Entertainment
LVMH,news,LVMH-owned leather-maker linked to deforestation pushes to weaken EU green law. NGO says Italian tanneries controlled by the French luxury group are seeking exemptions to EU deforestation law while importing hides linked to Paraguayan forest loss.,2026-04-27T04:00:00Z,POLITICO.eu
LVMH,news,"How Costco Won in Japan. Costco had to re-think its real estate, merchandising and warehouse design to succeed in Japan, which is now its largest market outside of North America.",2026-04-08T17:38:14Z,Readtrung.com
LVMH,news,"Kering’s Gucci Fix Is Really a Group Survival Plan. The French luxury group wants to rebuild margins, clear inventory, and make Gucci matter again, but this is less a glow-up than a corporate repair job.",2026-04-16T14:06:57Z,Moby.co
LVMH,news,"2026 LVMH Prize announces the 9 finalists for the 13th Edition. The LVMH Prize for young fashion designers has unveiled its nine finalists for 2026, following the twenty who presented their collection at the LVMH showroom back in March.
The post 2026 LVMH Prize announces the 9 finalists for the 13th Edition appeared first…",2026-04-25T03:14:46Z,Fuckingyoung.es
LVMH,news,"Kering CEO pledges to double profit margins and revive Gucci brand​. FLORENCE, Italy, April 16 : Kering CEO Luca de Meo pledged to more than double the luxury group's operating profit margin and boost the appeal of its flagship brand Gucci as he sought to reassure investors unnerved by economic uncertainty and war in the Middl…",2026-04-16T10:48:09Z,CNA
LVMH,news,The Iran War Is Already Tanking Luxury Sales in the Gulf—Could Art Be Next?. 2026 seemed poised to be the year of the Gulf for the art market. It's not so clear now.,2026-04-21T19:17:55Z,ARTnews
LVMH,news,"The ultra-wealthy have a new favorite status symbol: From a $14.5 million guitar to an $812,500 bottle of wine, rare collectibles are on a tear. Traditional luxury is losing its luster; unique and rare items are growing in popularity as status symbols.",2026-04-18T07:00:00Z,Fortune
LVMH,news,"What caused LVMH prize 2026 finalists? #lifestyle. What the 2026 LVMH Prize finalists announcement means LVMH has published its list of 2026 LVMH Prize finalists, separating the competition into three related honors: the LVMH Prize , the Karl Lagerfeld Prize , and the Savoir Faire Prize . The structure is des…",2026-04-24T12:03:26Z,Alltoc.com
LVMH,news,Fondation Louis Vuitton to host Alexander Calder retrospective. “Calder. Rêver en équilibre” will run from April 15 through Aug. 16.,2026-04-08T17:09:55Z,Luxurydaily.com
LVMH,news,"Luxury Giants Slump as Gulf Demand Seizes Up Due to War. Seven weeks of war in the Middle East are stifling demand in the luxury industry with LVMH, Kering and Hermès all reporting weak first-quarter sales.",2026-04-15T14:35:58Z,Financial Post
UniQlo,news,"Things I learned from Reddit fashion. When it comes to clothes, I live at the “low cost/low time/low quality” end of the pareto frontier. But the bay area had a sudden attack of weather this December, and the cheap sweaters on Amazon g…",2026-04-07T14:35:13Z,Acesounderglass.com
UniQlo,news,"7 U.S. Shopping Destinations That Take Retail Therapy Seriously. From New York City to Charleston, these U.S. shopping destinations offer everything from luxury boutiques to charming local finds.",2026-03-31T22:29:00Z,Mental Floss
UniQlo,news,"Bottoms Are The New Tops. Plus ASICS shorts, a Rier fleece polo, and Miu Miu sunnies",2026-04-09T18:56:16Z,Highsnobiety
UniQlo,news,"Soft Pants on Sale, Rare Discounts on the Ordinary, and More Weekend Deals. Our deals editor found the best sales online, including Naadam’s Friends and Family Sale, Best in Class baby bottles, and 30 percent off T3’s hair tools.",2026-04-10T18:47:53Z,The Cut
UniQlo,news,Who Wants To Be A Millionaire: All 15 questions answered correctly by show's seventh winner - but how many can YOU get right?. Retired IT consultant Roman Dubowski became the seventh winner of Who Wants To Be A Millionaire during Sunday's opening episode of the 35th series of the ITV show.,2026-04-26T22:02:34Z,Dailymail.com
UniQlo,news,"Andy Warhol’s Former Studio Building Now Home to New Uniqlo Union Square Store. Andy Warhol's former studio, the Factory, was in the same building on Broadway that is now home to Uniqlo's Union Square outpost.",2026-04-02T20:09:49Z,ARTnews
UniQlo,news,Noah Wyle Taps Todd Synder for Hollywood Walk of Fame Look. The Pitt's Noah Wyle wore a linen Todd Snyder suit to receive his star on the Hollywood Walk of Fame. Here's how you can own it (or something very similar).,2026-04-15T19:52:23Z,menshealth.com
UniQlo,news,"The best dressed golfers on tour. Although Adam Scott, Keith Mitchell and Jason Day dress very differently, their styles are derived from the same guiding principle: Unapologetic individuality.",2026-04-21T12:31:16Z,Yahoo Entertainment
UniQlo,news,"Consumer Check-In: What Shoppers Really Think About Sustainability. Shoppers share how sustainability factors into what they buy, what they trust and what actually influences their decisions.",2026-04-23T17:00:00Z,WWD
UniQlo,news,"Designers collaborations are popping up all over the high street but THIS is the range worth investing in: think clever cuts, natural fibres and prices we can actually afford. DINAH VAN TULLEKEN. BIG designer names are no longer confined to the runway - they're now popping up all over the High Street.",2026-04-21T15:14:10Z,Dailymail.com
UniQlo,news,"Uniqlo Boosts U.S. Presence With a Flurry of Store Openings in NYC and Beyond. Along with the brick-and-mortar expansion, the Japanese fashion retailer raises its profile by collaborating with cultural and sports institutions.",2026-04-02T21:23:24Z,WWD
UniQlo,news,This $20 Uniqlo Striped Baby Tee Is the Spring Staple I Keep Reaching For. An affordable staple you can keep reaching for this summer.,2026-04-25T00:02:39Z,Cosmopolitan.com
UniQlo,news,"Bastien Daguzan Exits as Fear of God CEO. Bastien Daguzan parting ways with Fear of God, which 'made the decision to remove the office of the CEO from its organizational structure,' the company told WWD.",2026-04-08T17:11:24Z,WWD
UniQlo,news,"Seán McGirr Brings McQueen Closer to Local Students, VIPs With First Official China Trip. The designer's four-day whirlwind trip to Shanghai included a talk at Donghua University and a showcase of the brand's fall 2026 collection.",2026-04-20T16:54:14Z,WWD
UniQlo,news,Who Wants to Be a Millionaire? crowns seventh winner of jackpot prize. Test yourself with his 15 winning questions to see if you would have won the cash prize,2026-04-27T07:25:59Z,The-independent.com
UniQlo,news,"Forget old, frumpy clothes! These accessories will upgrade any drab outfit, without the big price tag - especially if you're over 50. Every spring, as I pull my warm-weather wardrobe out from hibernation, I feel a little underwhelmed.My well-loved dresses and skirts look lacklustre, and I hear the siren call of an online shopping spree.",2026-04-23T14:22:45Z,Dailymail.com
UniQlo,news,"How Function and Price Are Shaping Festival Fashion Trends in 2026. Practicality is increasingly taking priority, even among young festivalgoers who would rather stay comfortable than worry about fashion.",2026-04-06T13:00:00Z,WWD
UniQlo,news,"When It Comes to Licensing, Some Artists Cash in While Others Push Back. According to a study conducted by Licensing International, global retail sales of licensed merchandise for art properties reached $3.95 billion in 2024.",2026-04-01T18:16:36Z,Observer
UniQlo,news,Why Amanda Lear is the Muse Who Never Goes Out of Fashion. The former companion of Salvador Dalí is a legendary fixture on the front row and is never far from designers' mood boards.,2026-04-25T04:30:00Z,WWD
UniQlo,news,Who Wants To Be A Millionaire crowns its SEVENTH winner as retired IT consultant soars to £1million question with two lifelines intact. Retired IT consultant Roman played an epic game of Who Wants To Be A Millionaire on Sunday night.,2026-04-26T20:11:57Z,Dailymail.com
UniQlo,news,Pat McGrath Labs Is Exiting Bankruptcy. Now What?. Pat McGrath Labs exits bankruptcy with new leadership. Can the iconic artistry brand regain its commercial success in a competitive market?,2026-04-24T19:53:16Z,WWD
UniQlo,news,In a rut from the gloomy weather? Here’s what to wear Easter weekend. Here’s how to celebrate the bank holiday weekend in style,2026-04-04T14:07:08Z,The-independent.com
UniQlo,news,"When $1.4 Billion Isn’t Enough: ‘Avatar’ Sequels Under the Microscope as Disney Weighs Franchise’s Future. James Cameron's latest installment could be the mid-point of the series or it could be the end
The post When $1.4 Billion Isn’t Enough: ‘Avatar’ Sequels Under the Microscope as Disney Weighs Franchise’s Future appeared first on TheWrap.",2026-04-08T13:00:00Z,TheWrap
Woolworths Australia,news,"Breaking: Class action filed against Kmart alleges 'systemic' wage underpayment. Kmart managers have alleged they were routinely required to work ""well beyond"" their rostered hours without receiving overtime rates, penalty rates, or prescribed allowances.",2026-04-02T04:00:54Z,ABC News (AU)
Woolworths Australia,news,"Criteo and DoorDash expand retail commerce media partnership. Under the agreement, Criteo will support DoorDash’s advertising sales activities in Canada by bringing additional brand and agency demand across North...",2026-04-17T11:11:52Z,Retail-insight-network.com
Woolworths Australia,news,"Coles & Woolworths 1/2 Price: Häagen-Dazs Ice Cream Tub 457ml $7.25, Kellogg's Nutri Grain 470g $4.50 + 183 More. Catalogue Half-Price Report — 2026-04-29 Valid from Wed 29 April to Tue 5 May. Taken from the NSW catalogue. 185 items at 50%+ off (105 Coles, 80 Woolworths) This is the catalogue from Wednesday …",2026-04-27T07:20:45Z,Ozbargain.com.au
Woolworths Australia,news,Milk prices may need to increase to cover soaring fuel and fertiliser costs. Dairy farmers across Australia are battling crippling fuel and fertiliser costs. The industry is now calling for a 30-cent-per-litre rise in milk prices on supermarket shelves.,2026-04-10T20:33:21Z,ABC News (AU)
Woolworths Australia,news,Surcharges on debit and credit cards to go from October. The removal of surcharges on debit and credit cards is one of the sweeping reforms from the Reserve Bank.,2026-03-30T23:16:04Z,ABC News (AU)
Woolworths Australia,news,"Overheated cows, flooded highways, and now a fuel crisis: why Australia’s food system is in big trouble. Australia produces enough food for 75 million people. But intensifying heat and natural disasters and competition for water are eroding food security.",2026-04-20T20:08:13Z,The Conversation Africa
Woolworths Australia,news,Fuel crisis driving some farmers to consider abandoning harvests. Tasmanian farmers are considering not harvesting crops like broccoli and cauliflower because increasing freight costs are proving to be so debilitating.,2026-04-02T21:24:27Z,ABC News (AU)
