company,source_type,text,published_at,source
Woolworths Australia,news,"What’s open and closed this Easter Sunday 2026 in Australia? Check Supermarket and shopping centre timings and trading hours. Easter Sunday 2026 approaches with varied shopping hours across Australia. Major supermarkets like Woolworths, Coles, and ALDI will have different opening times. Many stores will close on Good Friday and Easter Sunday. Shoppers should check local store detail…",2026-04-04T09:51:05Z,The Times of India
Woolworths Australia,news,Easter trading hours 2026: Reduced retail operations nationwide as Easter Monday sees limited openings across Australia. Australian shoppers face limited retail access this Easter long weekend. Major supermarkets and chains will operate on reduced hours or remain closed. Easter Monday trading varies widely by state. Shoppers are urged to check local store timings in advance to …,2026-04-06T03:57:03Z,The Times of India
Woolworths Australia,news,"From No Pokies to no MPs: Last SA Best member proud of party's legacy after losing seat. SA Best, the party formed by stunt-loving politician Nick Xenophon, has closed its chapter in South Australian political history with its final member Connie Bonaros losing her seat in last month's state election.",2026-04-11T21:23:13Z,ABC News (AU)
Woolworths Australia,news,"3 blue-chip ASX dividend shares to buy and hold. Let's see why these shares could be top picks for income investors.
The post 3 blue-chip ASX dividend shares to buy and hold appeared first on The Motley Fool Australia.",2026-03-29T20:25:51Z,Motley Fool Australia
Woolworths Australia,news,"3 of the best ASX retirement shares to buy now. Building a retirement portfolio? Here are three top shares to consider for it.
The post 3 of the best ASX retirement shares to buy now appeared first on The Motley Fool Australia.",2026-04-08T21:38:33Z,Motley Fool Australia
Woolworths Australia,news,"3 ASX shares for a winning retirement portfolio. Here's what makes these shares top picks for retirees.
The post 3 ASX shares for a winning retirement portfolio appeared first on The Motley Fool Australia.",2026-04-18T19:36:00Z,Motley Fool Australia
Woolworths Australia,news,'Out of the pocket of taxpayers': Unis spend $1.8b on consultants and contractors. Consultancies have been accused of infiltrating universities and wasting scarce public funds on questionable advice about cutting courses and jobs.,2026-03-29T18:50:09Z,ABC News (AU)
Woolworths Australia,news,How court cases against Woolworths and Coles could change the future of shopping in Australia. These cases will set the rules for what ‘truth in advertising’ means in Australia – and how closely buyers will need to beware discount price claims.,2026-04-22T02:19:40Z,The Conversation Africa
Woolworths Australia,news,"Australia Quick Commerce Databook Report 2026: Market Size & Forecast by Value and Volume Across 100+ KPIs by Product Type, Payment Mode, Age Group, Location, Business Model, Delivery Time 2020-2029. Key opportunities in Australia's quick commerce market include retailer-led integration in grocery and alcohol delivery, geographical expansion into regional areas, and the convergence of multi-category ecosystems. As price sensitivity increases, optimising d…",2026-04-21T08:01:00Z,GlobeNewswire
Woolworths Australia,news,Frozen veg in New Zealand: The data behind McCain and Wattie’s cuts. Households now spend about $312m a year on frozen and processed vegetables.,2026-04-09T21:00:00Z,New Zealand Herald
Woolworths Australia,news,"Nervous investors turn to ASX 200 defensives as global energy shock drags on. ASX investors sought safety in defensive sectors last week.
The post Nervous investors turn to ASX 200 defensives as global energy shock drags on appeared first on The Motley Fool Australia.",2026-04-25T20:00:00Z,Motley Fool Australia
Woolworths Australia,news,New Zealand First to campaign on breaking up supermarket duopoly. A three-point plan to shake up the supermarket sector and deliver lower prices for Kiwis.,2026-04-19T00:13:05Z,New Zealand Herald
Woolworths Australia,news,What's in 'Australian Made' products? Not necessarily Australian produce. Farmers battling cheap imported produce want a review of food labelling laws to highlight what Australian produce is included in products.,2026-04-08T21:00:59Z,ABC News (AU)
Woolworths Australia,news,"A wave of low-cost electric trucks is heading for Australia. Diesel trucks are the backbone of the national supply chain, but figures buried in recent sales data could mark the beginning of the end for these kings of the road.",2026-04-09T05:18:21Z,ABC News (AU)
Woolworths Australia,news,"Petrol stations tried to 'shape' the market – now it's shaping them. Petrol stations in our biggest cities hiked prices ahead of global oil prices, but experts say their profit margins are now much slimmer.",2026-03-30T19:31:35Z,ABC News (AU)
Woolworths Australia,news,Money’s tight but food prices are up. Here’s how to save on your grocery bill. You don’t need to go without meat or dairy to afford your weekly shop. Here’s how to choose lower-cost items and spot bargains.,2026-04-08T05:02:03Z,The Conversation Africa
Woolworths Australia,news,"No‑one has been prosecuted for wage theft since it became a crime. 2 inquiries want answers. For workers still being deliberately underpaid, it’s vital to ensure these laws are actually working.",2026-04-16T18:42:22Z,The Conversation Africa
Woolworths Australia,news,"Easter Monday: Are Woolworths, Coles, Other Stores Open?. The Easter long weekend is about to end, and here's a quick guide on which supermarkets, stores, and shopping centres will reopen on Easter Monday.",2026-04-06T04:00:44Z,Ibtimes.com.au
Woolworths Australia,news,Inside Four Square: How to become a supermarket owner – 10 grocers tell their stories. The long road to owning a supermarket: Why these grocers went all in.,2026-04-27T17:00:00Z,New Zealand Herald
Woolworths Australia,news,"Coles, Woolworths, Liquorland, BWS, Kmart, Bunnings: What shops are open this Anzac weekend?. Find out what's open around the country this Anzac Day.",2026-04-24T04:08:00Z,Dailymail.com
Woolworths Australia,news,"Australia’s food system at risk: Climate change, flooded highways and now a fuel crisis – Analysis. ANALYSIS: Challenges mean Australia can no longer take its food security for granted.",2026-04-24T03:35:16Z,New Zealand Herald
Woolworths Australia,news,"Easter 2026 Trading Hours Australia: When Shops Open This Long Weekend. SYDNEY, Australia — Australians heading into the Easter long weekend from April 3 to 6, 2026, face a patchwork of retail trading restrictions that vary significantly by state and territory, with major supermarkets, shopping centres and bottle shops observing …",2026-04-02T06:38:08Z,Ibtimes.com.au
Woolworths Australia,news,Canadian maple syrup is cheaper in Australia. An expert explains why you might be seeing higher prices. A Reddit post comparing prices in Loblaws with Australia's Woolworths has sparked outrage online,2026-04-09T18:50:42Z,National Post
Coles Group,news,"6 Songs You Might Not Know Were Written By Bruce Springsteen. In addition to his long list of hits, The Boss is responsible for other great songs you might not have known he wrote.",2026-04-13T16:00:03Z,Mental Floss
Coles Group,news,"Daisy Ridley's New R-Rated Zombie Thriller Finally Releases On Hulu In 2 Weeks. Daisy Ridley's new R-rated zombie thriller finally releases on Hulu in just two weeks, nearly four months after its theatrical release.",2026-04-21T00:04:27Z,Screen Rant
Coles Group,news,"The Serial Killers Return. There’s an air of confidence that comes with being as revered as someone like B-Real or Xzibit. There’s nothing left to prove. Their contributions to hip-hop are well documented. They’re a permanent part of the culture’s history. They’ve blazed trails, broken…",2026-04-07T12:00:00Z,Spinmagazine.com
Coles Group,news,Project Mario: the inside story of DeepMind. The inside story of how DeepMind’s experiments in AI safety governance transformed Demis Hassabis from an idealist into a realist,2026-03-31T15:18:40Z,Colossus.com
Coles Group,news,Supermarket milk price rises tipped to help hundreds of dairy farmers. War-related milk price rises at supermarkets are predicted in the coming months as hundreds of dairy farmers battling increasing costs receive more for their product.,2026-04-15T20:55:23Z,ABC News (AU)
Coles Group,news,"[Westpac, StG, BoM, BSA] Gift Card Bonus Cashback: 8% Coles Group & Myer, 8% Kmart @ ShopBack. Bonus cashback is based on the amount paid with your linked eligible Bank card. Gift Card Standard Cashback Bonus Cashback Total Cashback Coles Group & Myer 1% 8% 9% …",2026-04-07T14:02:56Z,Ozbargain.com.au
Coles Group,news,"3 reasons to buy Coles shares today. A leading analyst expects Coles shares are well-placed to outperform. But why? 
The post 3 reasons to buy Coles shares today appeared first on The Motley Fool Australia.",2026-04-20T01:57:32Z,Motley Fool Australia
Coles Group,news,‘We should absolutely make the playoffs every single year’: Mammoth balancing excitement with expectations. Here’s what playoff hockey is all about.,2026-04-10T22:06:46Z,Deseret News
Coles Group,news,"The 45 phone pings that traced the last known steps of Celine Cremer. Belgian backpacker Celine Cremer was on the trip of a lifetime, but on a hike in Tasmania she left the trail and was never seen again. It took a private investigator, a YouTuber, loved ones and an army of volunteers to find answers.",2026-04-12T18:48:01Z,ABC News (AU)
Coles Group,news,"$5,000 invested in Coles shares 10 days ago is now worth…. Coles shares are trading in the green again on Thursday morning.
The post $5,000 invested in Coles shares 10 days ago is now worth… appeared first on The Motley Fool Australia.",2026-04-09T01:22:15Z,Motley Fool Australia
Coles Group,news,Milk prices may need to increase to cover soaring fuel and fertiliser costs. Dairy farmers across Australia are battling crippling fuel and fertiliser costs. The industry is now calling for a 30-cent-per-litre rise in milk prices on supermarket shelves.,2026-04-10T20:33:21Z,ABC News (AU)
Coles Group,news,"4/25/26: Canyon Music & Art Festival - $10. 2026 Music and Art Festival – a family friendly, community building school fundraiser! Get your tickets here: bit.ly/4sfQKbk
General Admission Includes:
Live music (Ruby Lee Hill, Leah & Jeremy, Sibling Revelry, Súil na Seabhac, Canyon Critters, Dungeon Maste…",2026-04-04T19:36:06Z,Funcheap.com
Coles Group,news,"What’s open and closed this Easter Sunday 2026 in Australia? Check Supermarket and shopping centre timings and trading hours. Easter Sunday 2026 approaches with varied shopping hours across Australia. Major supermarkets like Woolworths, Coles, and ALDI will have different opening times. Many stores will close on Good Friday and Easter Sunday. Shoppers should check local store detail…",2026-04-04T09:51:05Z,The Times of India
Coles Group,news,"Meghan Markle advert removed from fashion website after she was criticised for selling 'look' she wore while meeting Bondi beach terror attack survivors. The Duchess of Sussex was criticised after her $2,000 'look' when she met survivors of the massacre was posted on a website where she is paid a percentage from sales.",2026-04-21T23:22:05Z,Dailymail.com
Coles Group,news,"Brad Stevens talked Jayson Tatum, the Celtics ceiling, and more. Here’s everything I took away.. Brad Stevens talked Jayson Tatum, Nikola Vucevic, and Joe Mazzulla and the coaching staff in a wide-ranging interview.",2026-04-08T17:58:18Z,Celtics Blog
Coles Group,news,"New Episodes of ""Tyler Perry's Divorced Sistas"" Arrive on Paramount+ April 15. The eight-episode conclusion to season one will debut with two episodes at launch, followed by a weekly rollout, culminating in the season finale on Wednesday, May 27.",2026-04-07T11:30:00Z,Thefutoncritic.com
Coles Group,news,"The reliable ASX dividend shares I'd buy with $10,000. Building passive income starts with the right foundations. Here are three ASX shares I would consider today.
The post The reliable ASX dividend shares I'd buy with $10,000 appeared first on The Motley Fool Australia.",2026-04-07T02:45:24Z,Motley Fool Australia
Coles Group,news,"2 ASX blue-chip shares offering big dividend yields. These businesses can provide investors with good passive income. 
The post 2 ASX blue-chip shares offering big dividend yields appeared first on The Motley Fool Australia.",2026-04-14T03:00:00Z,Motley Fool Australia
Coles Group,news,"Australia Quick Commerce Databook Report 2026: Market Size & Forecast by Value and Volume Across 100+ KPIs by Product Type, Payment Mode, Age Group, Location, Business Model, Delivery Time 2020-2029. Key opportunities in Australia's quick commerce market include retailer-led integration in grocery and alcohol delivery, geographical expansion into regional areas, and the convergence of multi-category ecosystems. As price sensitivity increases, optimising d…",2026-04-21T08:01:00Z,GlobeNewswire
Coles Group,news,"1 ASX dividend stock down 22% I'd buy right now. It could be a great time to invest in this leading business.
The post 1 ASX dividend stock down 22% I'd buy right now appeared first on The Motley Fool Australia.",2026-04-07T00:33:29Z,Motley Fool Australia
Coles Group,news,"This massive 3D map of 47 million galaxies could unlock dark energy. A massive cosmic milestone has just been reached: scientists have completed the largest high-resolution 3D map of the universe ever created. Built using data from over 47 million galaxies and quasars, this map could unlock new clues about dark energy—the myst…",2026-04-28T07:33:32Z,Science Daily
Coles Group,news,"Nervous investors turn to ASX 200 defensives as global energy shock drags on. ASX investors sought safety in defensive sectors last week.
The post Nervous investors turn to ASX 200 defensives as global energy shock drags on appeared first on The Motley Fool Australia.",2026-04-25T20:00:00Z,Motley Fool Australia
Coles Group,news,"Sex teacher Jenny Keane: ‘Are Irish people sexually repressed? I always say absolutely not. No way’. The Irish educator and entrepreneur on her work helping to change attitudes, create community, grow knowledge and break down taboos",2026-04-18T04:00:00Z,The Irish Times
Coles Group,news,Every NFL team's best draft class of the 21st century. Several draft classes helped lay down the foundation for a championship,2026-04-21T10:00:52Z,CBS Sports
Coles Group,news,"A cortico-subthalamic circuit rapidly engages and releases inhibition of specific movements depending on the environmental context. How does the human brain stop movements under realistic conditions? Using intracranial recordings and multi-variate EEG decoding, this study shows that a fronto-basal ganglia circuit featuring the subthalamic nucleus rapidly engages and releases inhibition of…",2026-04-24T14:00:00Z,Plos.org
Coles Group,news,Club-by-club guide to the 2026 County Championship. BBC local radio cricket commentators take a look at each County Championship side's prospects for the 2026 season.,2026-04-02T10:19:59Z,BBC News
Coles Group,news,"Sydney's 10 Largest Shopping Malls in 2026 Offer Massive Retail Space Amid Strong Sales Growth. SYDNEY — Australia's retail heart continues beating strongly in Sydney, where the 10 biggest shopping malls by gross leasable area (GLA) are delivering robust sales performance and attracting millions of visitors annually as of early 2026, even as industry-wi…",2026-04-03T15:17:18Z,Ibtimes.com.au
Coles Group,news,"Rugby Jedi commentator Jed Thian dies in Thailand, family’s heartbreak as fans share memories. Jed Thian built a global following with his alternative rugby commentary.",2026-04-23T01:04:44Z,New Zealand Herald
Gucci,news,"Gucci-branded Google smart glasses are coming next year. Google is reportedly partnering with Gucci to make a pair of AI smart glasses stylish enough people might actually want to wear them. According to Reuters, Gucci parent company Kering is planning to launch the glasses sometime in 2027. Google's first pair of …",2026-04-16T20:31:31Z,The Verge
Gucci,news,"Google Wants to Put Gucci Smart Glasses on Your Face. Luxury smart glasses, anyone?",2026-04-16T20:30:31Z,Gizmodo.com
Gucci,news,"Google’s next smart glasses bet brings Gucci into the mix. Google and Gucci are teaming up on Android XR smart glasses, aiming to finally make wearable tech stylish, useful, and ready for everyday use.",2026-04-20T13:19:57Z,Android Central
Gucci,news,"Gucci unveils Memoria exhibition at fuorisalone 2026. Promotion: fashion brand Gucci presents an immersive exhibition spotlighting its history through installations, tapestries and botanical spaces at this year's Milan design week. Read more",2026-04-24T20:00:37Z,Dezeen
Gucci,news,The Race for Fashion Smart Glasses Is On. Gucci next on deck? It's all starting to feel like smartwatches circa 2017.,2026-04-17T16:14:21Z,CNET
Gucci,news,Exciting Google and Gucci luxury smartglasses may be a bigger deal than you think. A new wave of luxury wearable tech,2026-04-20T09:52:37Z,Android Police
Gucci,news,"Americans are buying more used clothes, but the real story is who’s buying what: Luxury resale is booming and so is discount. ""We’re seeing that growth isn't uniform, and it really is concentrated, seemingly, at the high and low ends of the market when it comes to clothes.""",2026-04-24T15:11:15Z,Yahoo Entertainment
Gucci,news,"Android XR could get its own luxury rival to Ray-Ban Meta next year. Gucci owner Kering says its Android XR smart glasses could arrive in 2027, making it one of the first luxury brands in the space.",2026-04-16T20:44:14Z,Android Authority
Gucci,news,"This menswear status symbol is so subtle you might not even notice it. Monograms were once used to differentiate items at dry cleaners. Now, clothes and accessories that feature the small letters signal status.",2026-04-18T09:42:01Z,Business Insider
Gucci,news,"The Most Underrated Thing at Milan Design Week? The Staff Uniforms. Milan Design Week is very different from Milan Fashion Week, but it's not an entirely fashion-less affair. Just look at the Yohji Yamamoto staff uniforms!",2026-04-22T17:01:00Z,Highsnobiety
Gucci,news,"Google to Launch Gucci-Branded Android XR Smart Glasses in 2027. Kering, the fashion group behind Gucci, has announced a partnership with Google to develop luxury smart glasses, with a planned launch in 2027.
Thank you for being a Ghacks reader. The post Google to Launch Gucci-Branded Android XR Smart Glasses in 2027 appea…",2026-04-21T08:43:18Z,Ghacks Technology News
Gucci,news,"Gucci Is Going After Ray-Ban Meta, With Google’s Help. Luxury AI eyewear is about to meet your face, and the name on the temples might just be Gucci. Kering CEO Luca de Meo has confirmed that Gucci is teaming up with Google on a pair of AI smart glasses, widely reported to run on Android XR, and the project is al…",2026-04-18T17:00:25Z,The Gadgeteer
Gucci,news,“Wearing Dried Human Skin”: Zendaya’s “Eerie” Look At CinemaCon Sparks Brutal Reactions Online. Zendaya never disappoints when it comes to sparking conversation around her bold red carpet fashion.,2026-04-15T17:54:19Z,Boredpanda.com
Gucci,news,"7 U.S. Shopping Destinations That Take Retail Therapy Seriously. From New York City to Charleston, these U.S. shopping destinations offer everything from luxury boutiques to charming local finds.",2026-03-31T22:29:00Z,Mental Floss
Gucci,news,"Google And Gucci Collaborate On Luxury AI-Enhanced Smart Glasses For 2027. More than a decade after the original Google Glass failed to achieve mainstream appeal, Google is pivoting its strategy toward the luxury fashion sector. In a bid to redefine smart eyewear as a desirable consumer accessory, Google has entered a strategic part…",2026-04-19T21:36:26Z,Ubergizmo
Gucci,news,"Watch: Spike Jonze Directs Zendaya in Surreal 'Shape of Dreams' Ad. Dream On? Time for another dose of ""but when will Spike Jonze ever directed a new movie?"" distraction. Alas there's still no word on if he's directing a feature film project anytime soon. But while we wait, patiently for it to happen one day, he is still whip…",2026-04-10T20:43:06Z,First Showing
Gucci,news,"Honestly, When Was Leather Ever Not the Answer?. Leather is back. Not that it ever left. From jackets to shoes to accessories, here's why the material that outlasts every trend is the only one worth investing in right now.",2026-04-07T11:00:00Z,Highsnobiety
Gucci,news,"Samsung’s upcoming Galaxy Glasses could be rivaled by… Gucci?. Samsung is expected to unveil its first smart glasses later this year. They will compete with Meta’s existing AI glasses and Apple’s rumored upcoming smart glasses. However, Samsung could face another unexpected competitor: Gucci, the luxury fashion brand fro…",2026-04-17T08:12:15Z,SamMobile
Gucci,news,"The Job That Broke Gucci Also Built Hermès. In fashion, the creative director sits alongside the CEO, occasionally as the more powerful of the two.",2026-04-01T06:30:00Z,Adweek
Gucci,news,"Rebecca Rusheen Joins Creators Division Of CAA. Rebecca Rusheen has joined CAA as an agent in the Creators division following stints at Gersh and the now-defunct A3 Artists Agency. “Rebecca is a highly respected and forward-thinking agent, renowned for her sharp instinct in identifying exceptional talent a…",2026-03-31T19:00:00Z,Deadline
Gucci,news,"Louvelle Links Lenders And Renters Of High-End Fashion. Tanya Tamer, who turned a love of fashion into a successful career, created Louvelle, an invitation-only luxury fashion  platform.",2026-04-23T19:23:04Z,Forbes
Gucci,news,"Milan Design Week 2026's Best Moments Felt Real. We ranked the best moments at Milan Design Week 2026, from Miu Miu's book club to Capsule Plaza to a surprise C.P. Company collaboration.",2026-04-24T16:10:53Z,Highsnobiety
Gucci,news,"Ballet continues to thrive thanks to Saul Nash’s designs. The London designer has teamed up with the Royal Ballet for some futuristic costumes, plus more fashion news you missed",2026-04-24T16:27:00Z,Dazed
Gucci,news,"Gucci’s Renaissance: Kering CEO Luca de Meo Unveils Strategies to Revive Brand. The executive outlined a comprehensive vision to restore Gucci’s status as a global luxury powerhouse, emphasizing clarity, cultural relevance and...",2026-04-16T17:48:28Z,WWD
Gucci,news,"Can OnlyFans Save Fashion?. With sex back on the runway and an increasingly challenged retail landscape, is OnlyFans fashion’s next frontier?",2026-04-08T23:30:31Z,Vanity Fair
Gucci,news,"Nike is walking on Air at Milan Design Week. The sportswear giant staged an exhibition celebrating its '‘invisible ingredient’. Plus: design week highlights from Gucci, Fendi and Bottega Veneta",2026-04-27T17:28:00Z,Dazed
Gucci,news,"Gucci reportedly releasing Android XR smart glasses in 2027. Last year, Google told the world that it had been working with companies like Warby Parker and Gentle Monster on smart glasses; however, now we’re learning about Gucci-branded Android XR glasses. According to Reuters, Gucci-branded smart glasses are coming ne…",2026-04-16T22:18:56Z,MobileSyrup
Gucci,news,Moncler is coming for summer with its line of little puffs. The Italian outwear giant stakes its claim on the sunny season with Jamie Dornan in tow… plus more fashion news you missed,2026-04-17T13:48:00Z,Dazed
Gucci,news,"What the Fashion at Coachella Says About the State of the Festival. Coachella performances have grown bigger in scale and showmanship. They now rival the staging of a high-profile world tour, and their costuming is closer to the runway than it’s ever been before.",2026-04-15T21:08:27Z,Vanity Fair
Gucci,news,"Gucci revives iconic £1,100 silk shirt made famous by Kate Moss and Madonna in 1995. They say the most iconic looks never truly go out of fashion - and this Gucci blouse may just be the proof.",2026-04-26T21:44:51Z,Dailymail.com
